{
  "detail": "example-value",
  "fieldErrors": {},
  "instance": "https://problems.luna.akamaiapis.net/api-definitions/error-instances/d54686b5-21cb-4ab7-a8d6-a92282cf1749",
  "status": 404,
  "title": "Not Found",
  "type": "https://problems.luna.akamaiapis.net/api-definitions/error-types/NOT-FOUND"
}